{
  "$ref": "#/definitions/posts",
  "definitions": {
    "posts": {
      "type": "object",
      "properties": {
        "title": {
          "type": "string"
        },
        "slug": {
          "type": "string"
        },
        "date": {
          "type": "string"
        },
        "publishedDate": {
          "type": "string"
        },
        "excerpt": {
          "type": "string"
        },
        "content": {
          "type": "string"
        },
        "featuredImage": {
          "type": "object",
          "properties": {
            "src": {
              "type": "string"
            },
            "width": {
              "type": "number"
            },
            "height": {
              "type": "number"
            },
            "alt": {
              "type": "string"
            }
          },
          "required": [
            "src"
          ],
          "additionalProperties": false
        },
        "categories": {
          "type": "array",
          "items": {
            "type": "object",
            "properties": {
              "id": {
                "type": "number"
              },
              "name": {
                "type": "string"
              },
              "slug": {
                "type": "string"
              }
            },
            "required": [
              "id",
              "name",
              "slug"
            ],
            "additionalProperties": false
          },
          "default": []
        },
        "tags": {
          "type": "array",
          "items": {
            "$ref": "#/definitions/posts/properties/categories/items"
          },
          "default": []
        },
        "$schema": {
          "type": "string"
        }
      },
      "required": [
        "title",
        "slug",
        "date",
        "publishedDate",
        "content"
      ],
      "additionalProperties": false
    }
  },
  "$schema": "http://json-schema.org/draft-07/schema#"
}