{
  "title": "Wordless Wednesday: Best Friends",
  "slug": "wordless-wednesday-best-friends",
  "date": "20150204",
  "publishedDate": "2015-02-04",
  "excerpt": "<p>Wordless Wednesday: Best Friends If a picture is worth a thousand words, how many words is a four-in-one collage worth? This week, I must say “goodbye” see you soon to my best friend here in Philly, Tasha. She and her husband (and their adorable pup, Ollie) are moving a few hours away. I miss her [&hellip;]</p>\n",
  "content": "\n<p><strong>Wordless Wednesday: Best Friends</strong></p>\n<p>If a picture is worth a thousand words, how many words is a four-in-one collage worth? This week, I must say “<del>goodbye”</del> <em>see you soon</em> to my best friend here in Philly, Tasha. She and her husband (and their adorable pup, Ollie) are moving a few hours away. I miss her already.</p>\n<p>We were friendly for a couple years, and she was one of my favorite people to hang out with, but we became best friends right around the time I lost my mom. Setting bridal appointments and planning a wedding alone right after her death was really hard on me. Tasha offered to help and I took her up on it. We’d never even hung out alone, always with our husbands in tow, so I remember being a little nervous the first appointment she went with me to. Would I have anything to talk about with her? Would it be awkward? It wasn’t. She was still just as awesome, and I pretty much immediately asked her to be my bridesmaid.</p>\n<p>After that we just became closer, sharing the silliest stories, lots of wedding planning, a trip to <a title=\"New Orleans!\" href=\"/new-orleans/\">New Orleans</a>, and entirely too much food. It’s how we plan our evenings out… around what we want to eat. She’s one of my favorite people to talk to, and I hope that her absence in the city just forces us to chat more. I already promised her care packages and ridiculous cards in the mail, and I will start prepping them soon!</p>\n<p>I better stop now, or I’ll get too mushy for my own good! I’ll miss you, Tasha!!! <3 Sorry if you hate any of these photos- going through my albums, I realized I don’t have a whole lot of us together! We’ll have to fix that. 😉</p>\n<p>Has someone you loved ever moved away? What did you do to stay in touch?</p>\n",
  "featuredImage": {
    "src": "/posts/wordless-wednesday-best-friends/featured.png",
    "width": 663,
    "height": 250,
    "alt": "Wordless Wednesday: Best Friends on Katie Crafts; http://www.katiecrafts.com"
  },
  "categories": [
    {
      "id": 1,
      "name": "Hodgepodge",
      "slug": "hodgepodge"
    }
  ],
  "tags": [
    {
      "id": 1196,
      "name": "best friends",
      "slug": "best-friends"
    },
    {
      "id": 1197,
      "name": "friendship",
      "slug": "friendship"
    },
    {
      "id": 1002,
      "name": "moving",
      "slug": "moving"
    },
    {
      "id": 1050,
      "name": "wordless wednesday",
      "slug": "wordless-wednesday"
    }
  ]
}