{
  "title": "Taco Tuesday: 5 Recipes!",
  "slug": "taco-tuesday-5-recipes",
  "date": "20140909",
  "publishedDate": "2014-09-09",
  "excerpt": "<p>Taco Tuesday: 5 Recipes! (+ Bonus Burrito Recipe!) It’s Taco Tuesday! To celebrate, I spent many hours slaving away on Pinterest (read: 30 minutes enjoying Pinterest) to find you 5 taco recipes that make me drool! I also threw in a burrito recipe for Husband, because those are his favorite. I haven’t tried any of [&hellip;]</p>\n",
  "content": "<p><strong>Taco Tuesday: 5 Recipes! (+ Bonus Burrito Recipe!)</strong></p>\n<p>It’s Taco Tuesday! To celebrate, I spent many hours slaving away on Pinterest <em>(read: 30 minutes enjoying Pinterest)</em> to find you 5 taco recipes that make me drool! I also threw in a burrito recipe for Husband, because those are his favorite. I haven’t tried any of these yet, but certainly will once we move in to the new place and unearth our cookware!</p>\n<h2 style=\"text-align: center\"></h2>\n<h2 style=\"text-align: center\">#1. BBQ Tilapia and Sweet Potato Tacos</h2>\n<p style=\"text-align: center\">I’m not usually a fish person, unless it’s a very mild white fish like flounder or tilapia! And having it smothered in BBQ sauce and paired with sweet potatoes certainly helps! This recipe from <a title=\"Lemons and Basil BBQ Tilapia and Sweet Potato Taco Recipe\" href=\"http://lemonsandbasil.com/bbq-tilapia-and-sweet-potato-tacos/\" target=\"_blank\" rel=\"noopener noreferrer\">Lemons and Basil</a> is mouth watering. Where we are moving is two and a half blocks from the Italian Market, where I’ll be able to buy fresh produce, meat and fish whenever I please. I will definitely be trying this recipe out as soon as possible!</p>\n\n<h2 style=\"text-align: center\"> #2. Spicy Chicken Tacos With Corn, Feta and Avacado</h2>\n<p style=\"text-align: center\">I’m not really in to Feta cheese too much, so I may sub in something else, but overall this taco sounds pretty awesome! The recipe is from <a title=\"Serious Eats Spicy Chicken Taco\" href=\"http://www.seriouseats.com/recipes/2014/07/spicy-chicken-tacos-recipe.html\" target=\"_blank\" rel=\"noopener noreferrer\">Serious Eats</a> via Yasmin Fahr and they only take 20 minutes to make! I love spicy chicken and so does Husband, so I have a feeling this will be one we keep going back to.</p>\n\n<h2 style=\"text-align: center\"> #3. Korean BBQ Short Rib Tacos</h2>\n<p style=\"text-align: center\">Mmm. Just thinking about them makes me dizzy. Korean BBQ short rib tacos are one of my favoritest things on the whole entire planet. They are involved, and the ingredients list is far too long for something I will inhale in 45 seconds flat, but for those of you who want the challenge, here is a recipe from <a title=\"Korean BBQ Tacos on Lady and Pups\" href=\"http://www.ladyandpups.com/2012/11/21/chasing-kogi-truck-eng/\" target=\"_blank\" rel=\"noopener noreferrer\">Lady and Pups</a> that looks incredible.</p>\n<p><a href=\"http://www.ladyandpups.com/2012/11/21/chasing-kogi-truck-eng/\" target=\"_blank\" rel=\"noopener noreferrer\"><img loading=\"lazy\" decoding=\"async\" class=\"aligncenter size-medium wp-image-4246 post__image\" src=\"/posts/taco-tuesday-5-recipes/korean-taco-31-1024x681-1.jpg\" alt=\"Taco Tuesday: 5 Recipes on Katie Crafts; http://www.katiecrafts.com\" width=\"663\" height=\"440\"></a></p>\n<h2 style=\"text-align: center\"> #4. Taco Pizza</h2>\n<p style=\"text-align: center\">If traditional tacos aren’t your thing, or you really want a spin on the old classic, a taco pizza is definitely a fun route to go! I love the recipe from <a title=\"Taste of Home Taco Pizza\" href=\"http://www.tasteofhome.com/recipes/taco-pizza\" target=\"_blank\" rel=\"noopener noreferrer\">Taste of Home</a>!</p>\n<p style=\"text-align: center\"><a href=\"http://www.tasteofhome.com/recipes/taco-pizza\" target=\"_blank\" rel=\"noopener noreferrer\"><img loading=\"lazy\" decoding=\"async\" class=\"aligncenter size-full wp-image-4245 post__image\" src=\"/posts/taco-tuesday-5-recipes/exps1847-th0401c39d-2.jpg\" alt=\"Taco Tuesday: 5 Recipes on Katie Crafts; http://www.katiecrafts.com\" width=\"300\" height=\"300\"></a></p>\n<h2 style=\"text-align: center\"> #5. Layered Chopped Taco Salad</h2>\n<p style=\"text-align: center\"><a title=\"Foodie With Family Layered Chopped Taco Salad\" href=\"http://www.foodiewithfamily.com/2014/07/10/layered-chopped-taco-salad/\" target=\"_blank\" rel=\"noopener noreferrer\">Foodie With Family</a> is responsible for this deconstructed taco recipe, and it looks great! I love the idea of individual little bowls of salad using all taco ingredients. It looks way better than any taco salad I’ve received in a restaurant! Plus there are FRITOS on top! Anyway, salads are healthy… 😉</p>\n<h2 style=\"text-align: center\"><a href=\"http://www.foodiewithfamily.com/2014/07/10/layered-chopped-taco-salad/\" target=\"_blank\" rel=\"noopener noreferrer\"><img loading=\"lazy\" decoding=\"async\" class=\"aligncenter size-full wp-image-4244 post__image\" src=\"/posts/taco-tuesday-5-recipes/layered-chopped-taco-salad-3.jpg\" alt=\"Taco Tuesday: 5 Recipes on Katie Crafts; http://www.katiecrafts.com\" width=\"450\" height=\"675\"></a></h2>\n<h2 style=\"text-align: center\"></h2>\n\n<h2 style=\"text-align: center\">BURRITO BONUS: Neato Frito Over-stuffed Burrito</h2>\n<p style=\"text-align: center\">Husband actually found this one all on his own. It also hails from <a title=\"Neato Frito Over-stuffed Burrito on Foodie With Family\" href=\"http://www.foodiewithfamily.com/2014/02/11/neato-frito-overstuffed-burritos/\" target=\"_blank\" rel=\"noopener noreferrer\">Foodie With Family</a> (have you checked the site out yet? There are so many good recipes!) and I have to say, it looks disgustingly delicious (and I don’t usually go for burritos!) I mean, pulled pork…cheeses…guac…more Fritos… how can I say no? Just look at it. LOOK!</p>\n<p><a href=\"http://www.foodiewithfamily.com/2014/02/11/neato-frito-overstuffed-burritos/\" target=\"_blank\" rel=\"noopener noreferrer\"><img loading=\"lazy\" decoding=\"async\" class=\"aligncenter size-medium wp-image-4241 post__image\" src=\"/posts/taco-tuesday-5-recipes/neato-frito-overstuffed-burritos-4.jpg\" alt=\"Taco Tuesday: 5 Recipes on Katie Crafts; http://www.katiecrafts.com\" width=\"663\" height=\"442\"></a></p>\n<p>All of these recipes (at least, the ones in shells) require soft taco shells, but I always opt for hard ones if I can- the crunch is my favorite part of a taco! Now that I’m starving, I’m going to leave you to your taco dreams. Enjoy!</p>\n<p>Which of these recipes is your fave?</p>\n",
  "featuredImage": {
    "src": "/posts/taco-tuesday-5-recipes/featured.png",
    "width": 663,
    "height": 250,
    "alt": "Taco Tuesday: 5 Recipes on Katie Crafts; http://www.katiecrafts.com"
  },
  "categories": [
    {
      "id": 7,
      "name": "Cooks",
      "slug": "cooks"
    }
  ],
  "tags": [
    {
      "id": 1034,
      "name": "burrito",
      "slug": "burrito"
    },
    {
      "id": 1039,
      "name": "foodie with family",
      "slug": "foodie-with-family"
    },
    {
      "id": 1035,
      "name": "frito",
      "slug": "frito"
    },
    {
      "id": 1043,
      "name": "korean bbq taco",
      "slug": "korean-bbq-taco"
    },
    {
      "id": 1042,
      "name": "lady and pups",
      "slug": "lady-and-pups"
    },
    {
      "id": 1038,
      "name": "lemon and basil",
      "slug": "lemon-and-basil"
    },
    {
      "id": 954,
      "name": "recipes",
      "slug": "recipes"
    },
    {
      "id": 1040,
      "name": "serious eats",
      "slug": "serious-eats"
    },
    {
      "id": 1045,
      "name": "spicy chicken",
      "slug": "spicy-chicken"
    },
    {
      "id": 1037,
      "name": "sweet potato",
      "slug": "sweet-potato"
    },
    {
      "id": 1044,
      "name": "taco salad",
      "slug": "taco-salad"
    },
    {
      "id": 1033,
      "name": "taco tuesday",
      "slug": "taco-tuesday"
    },
    {
      "id": 1041,
      "name": "taste of home",
      "slug": "taste-of-home"
    },
    {
      "id": 1036,
      "name": "tilapia",
      "slug": "tilapia"
    }
  ]
}