{
  "title": "Heart Pillow with Pocket Tutorial",
  "slug": "heart-pillow-with-pocket-tutorial",
  "date": "20150113",
  "publishedDate": "2015-01-13",
  "excerpt": "<p>Project: Heart Pillow with Pocket Tutorial It’s the second week of January, so naturally it’s time to start our Valentine’s Day projects! This little sewing project is a quick work up, and perfect for any beginner- even your crafty kid! Use it to deliver a sweet little note to your Valentine, or perhaps a few [&hellip;]</p>\n",
  "content": "<p><strong>Project: Heart Pillow with Pocket Tutorial</strong></p>\n<p>It’s the second week of January, so naturally it’s time to start our <em>Valentine’s Day</em> projects! This little sewing project is a quick work up, and perfect for any beginner- even your crafty kid! Use it to deliver a sweet little note to your Valentine, or perhaps a few treats for your loved one!</p>\n<h2>Materials:</h2>\n<ul>\n<li>Sheet of paper + pencil</li>\n<li>Sewing machine</li>\n<li>Coordinating thread & needle</li>\n<li>Fabric in desired pattern and size</li>\n<li><a title=\"Poly-Fil\" href=\"http://amzn.to/1sdaUiy\" target=\"_blank\" rel=\"noopener noreferrer\">Poly-Fil</a> / stuffing</li>\n<li>Scissors</li>\n<li>Pins</li>\n</ul>\n<h2>Instructions:</h2>\n<ul>\n<li>Using the wonderful skills you learned in Kindergarten, fold your sheet of paper in half and trace half a heart. Cut it out with your scissors. This is now your pattern. If you hate it, trim away until you are happy with it’s size and shape. Remember, when you sew it together later, it will transform shape a little, so don’t be surprised when it doesn’t turn out looking EXACTLY as your paper heart does!</li>\n<li>Pin your new heart pattern to your fabric and cut out three hearts.</li>\n<li>Of these three, one will be the front of your pillow, one will be the back of your pillow, and one will be the pocket of your pillow. If your fabric is patterned, you may want to take a look at what each piece looks like and decide which you want to use for each area.</li>\n<li>Using whichever piece you choose to be your pocket, you will cut the top off of that heart to make a triangle. Don’t cut it down too small, or your pocket will be super tiny on the bottom of your heart!</li>\n<li>Fold over the edge you just cut about a half inch and pin. Sew across to make a small hem. I used a zig zag stitch to make it a little cuter! Leave the other two sides alone.</li>\n<li>Lay the pocket right side <em>up</em> on top of the piece you chose for your front (also right side up) so that it looks just how you want the finished product to be.</li>\n<li>Lay the back heart fabric piece right side <em>down </em>on top of the other two pieces, enveloping the pocket. Make sure all edges are matched up and pin all the way around.</li>\n<li>Use a straight stitch all the way around the heart to sew together all three pieces, leaving a small opening somewhere on the pillow for turning. I left my opening on the top to make it easier.</li>\n<li>Use scissors to trim excess, or pinking shears if you have them. Turn inside out through hole.</li>\n<li>Now that your pillow is completely adorable, you just need to stuff it! Fill it with poly-fil until it’s the firmness you desire, remembering to leave a little room near the hole for easier sewing.</li>\n<li>Use matching thread and a needle to hand stitch the opening closed, and you have yourself a Valentine pillow.</li>\n</ul>\n Pillow Front\n Pillow Back\n<p>Write a love note, slip it in the pocket, and leave it for your Husband to find! When Valentine’s Day is over, reuse the pillow for the Tooth Fairy for your kids! Such a cute little decoration, takes no time at all to make, and can be made in any size you desire. Happy crafting!</p>\n",
  "featuredImage": {
    "src": "/posts/heart-pillow-with-pocket-tutorial/featured.png",
    "width": 663,
    "height": 250,
    "alt": "Heart Pillow with Pocket Tutorial for Valentine's Day by Katie Crafts; http://www.katiecrafts.com"
  },
  "categories": [
    {
      "id": 1737,
      "name": "Crafts",
      "slug": "crafts"
    }
  ],
  "tags": [
    {
      "id": 53,
      "name": "beginner",
      "slug": "beginner"
    },
    {
      "id": 17,
      "name": "heart",
      "slug": "heart"
    },
    {
      "id": 132,
      "name": "kids",
      "slug": "kids"
    },
    {
      "id": 55,
      "name": "pillow",
      "slug": "pillow"
    },
    {
      "id": 1154,
      "name": "pocket",
      "slug": "pocket"
    },
    {
      "id": 13,
      "name": "sewing",
      "slug": "sewing"
    },
    {
      "id": 14,
      "name": "valentine's day",
      "slug": "valentines-day"
    }
  ]
}