{
  "title": "10 Free Bag Tutorials",
  "slug": "10-free-bag-tutorials",
  "date": "20150129",
  "publishedDate": "2015-01-29",
  "excerpt": "<p>I love finding blog posts that host a whole array of free patterns all together in one list, so I figured, “Why not do that myself?” One of the very first things I ever tried to sew was a reversible tote bag, and it’s still one of my favorite ones to date. Here are even [&hellip;]</p>\n",
  "content": "<p>I love finding blog posts that host a whole array of free patterns all together in one list, so I figured, <em>“Why not do that myself?” </em>One of the very first things I ever tried to sew was a reversible tote bag, and it’s still one of my favorite ones to date. Here are even more great bag patterns so that you have your pick at bunch!</p>\n<p>I scoured the webs and found these wonderful blogs with free bag tutorials for their readers. I can’t wait to try each of these tutorials out, because who can have too many bags?! Be sure to check each of them out below!</p>\n<ol>\n<li><strong><a title=\"Reversible Tote Bag Tutorial by Katie Crafts\" href=\"/reversible-tote-bag-tutorial/\">Reversible Tote Bag Tutorial by Katie Crafts</a></strong></li>\n<li><strong><a title=\"Pleated Pouch Tutorial with Pattern by Lemon Squeezy Home\" href=\"http://lemonsqueezyhome.com/2010/10/pleated-pouch-tutorial-with-pattern.html\" target=\"_blank\" rel=\"noopener noreferrer\">Pleated Pouch Tutorial with Pattern by Lemon Squeezy Home</a></strong></li>\n<li><strong><a title=\"School Party Satchel by ikatbag\" href=\"http://www.ikatbag.com/2011/10/school-party-satchels.html\" target=\"_blank\" rel=\"noopener noreferrer\">School Party Satchel by ikatbag</a></strong></li>\n<li><strong><a title=\"Ruffle Zipper Pouch by See Kate Sew\" href=\"http://seekatesew.com/ruffle-zipper-pouch-with-geometric-stitching\" target=\"_blank\" rel=\"noopener noreferrer\">Ruffle Zip Pouches by See Kate Sew</a></strong></li>\n<li><strong><a title=\"Little Betty Bag by The Mother Huddle\" href=\"http://www.themotherhuddle.com/little-betty-bag-free-pattern-and-tutorial/\" target=\"_blank\" rel=\"noopener noreferrer\">Little Betty Bag by The Mother Huddle</a></strong></li>\n<li><strong><a title=\"Bucket Bag by Elvie Studio\" href=\"http://elviestudio.blogspot.com/2014/05/inspiration-monday_19.html?utm_source=feedburner&utm_medium=email&utm_campaign=Feed:+ElvieStudio+%28elvie+studio%29\" target=\"_blank\" rel=\"noopener noreferrer\">Bucket Bag by Elvie Studio</a></strong></li>\n<li><strong><a title=\"Fairly Bucket Bag by Sew Mama Sew\" href=\"http://www.sewmamasew.com/2014/09/fairly-bucket-bag-tutorial/\" target=\"_blank\" rel=\"noopener noreferrer\">Fairly Bucket Bag by Sew Mama Sew</a></strong></li>\n<li><strong><a title=\"Tohoku Tote by I Am Mamma Hear Me Roar\" href=\"http://www.iammommahearmeroar.net/2011/09/tohoku-tote.html\" target=\"_blank\" rel=\"noopener noreferrer\">The Tohoku Tote by I Am Momma Hear Me Roar</a></strong></li>\n<li><strong><a title=\"The Grandview Bag by The Boy Trifecta\" href=\"http://www.theboytrifecta.com/2010/10/grandview-bag-formerly-known-as-anthro.html\" target=\"_blank\" rel=\"noopener noreferrer\">The Grandview Bag by The Boy Trifecta</a></strong></li>\n<li><strong><a title=\"Buttercup Bag by Made By Rae\" href=\"http://www.made-by-rae.com/2009/02/free-buttercup-bag-sewing-pattern/\" target=\"_blank\" rel=\"noopener noreferrer\">Buttercup Bag by Made By Rae</a></strong></li>\n</ol>\n<p>What other patterns should I make lists of? Which is your fave bag?</p>\n",
  "featuredImage": {
    "src": "/posts/10-free-bag-tutorials/featured.png",
    "width": 663,
    "height": 250,
    "alt": "10 Free Bag Tutorials on Katie Crafts; http://www.katiecrafts.com"
  },
  "categories": [
    {
      "id": 1737,
      "name": "Crafts",
      "slug": "crafts"
    }
  ],
  "tags": [
    {
      "id": 1184,
      "name": "bags",
      "slug": "bags"
    },
    {
      "id": 185,
      "name": "diy",
      "slug": "diy"
    },
    {
      "id": 34,
      "name": "free",
      "slug": "free"
    },
    {
      "id": 33,
      "name": "pattern",
      "slug": "pattern"
    },
    {
      "id": 1187,
      "name": "pocket book",
      "slug": "pocket-book"
    },
    {
      "id": 1186,
      "name": "purse",
      "slug": "purse"
    },
    {
      "id": 13,
      "name": "sewing",
      "slug": "sewing"
    },
    {
      "id": 1185,
      "name": "tote",
      "slug": "tote"
    },
    {
      "id": 187,
      "name": "tutorial",
      "slug": "tutorial"
    }
  ]
}