{
  "title": "",
  "slug": "mabel-on-desk",
  "date": "20140804",
  "publishedDate": "2014-08-04",
  "excerpt": "<p><p>Put down laptop screen, see what is hiding behind it.</p></p>",
  "content": "<p><img class=\"size-medium post__image\" src=\"/posts/mabel-on-desk/img-4938.jpg\" alt=\"Mabel on Desk on Katie Crafts; http://www.katiecrafts.com\" width=\"663\" height=\"497\"></p><p>Put down laptop screen, see what is hiding behind it.</p>",
  "categories": [
    {
      "id": 9,
      "name": "Cats",
      "slug": "cats"
    }
  ],
  "tags": [
    {
      "id": 370,
      "name": "kitty",
      "slug": "kitty"
    },
    {
      "id": 37,
      "name": "loves cats",
      "slug": "loves-cats-2"
    },
    {
      "id": 19,
      "name": "mabel",
      "slug": "mabel"
    }
  ]
}
