{
  "title": "Motivation Monday: Believe",
  "slug": "motivation-monday-believe-2",
  "date": "20150803",
  "publishedDate": "2015-08-03",
  "excerpt": "<p>I had a very lovely and relaxing weekend, though I didn’t get done a fraction of what I wanted to. That is why I thought it would be a good time for a Motivation Monday quote! This one comes from T. Roosevelt. </p>\n",
  "content": "<p>I had a very lovely and relaxing weekend, though I didn’t get done a fraction of what I wanted to. That is why I thought it would be a good time for a Motivation Monday quote! This one comes from T. Roosevelt. </p>\n<blockquote><p><em><strong>“Believe you can & you’re halfway there.”</strong></em><em><strong> </strong></em></p></blockquote>\n<p>The photo behind the quote is one I took yesterday when I was visiting <strong><a href=\"/shofuso-japanese-house-and-garden/\">Shofuso Japanese Gardens</a></strong>. You may have already seen the original on <strong><a href=\"https://instagram.com/p/548MsHM7nO/?taken-by=imkatiecrafts\" target=\"_blank\" rel=\"noopener noreferrer\">Instagram</a></strong>, but I thought it was a pretty great pic to use for this quote! What do you think? I can’t wait to go back again in the Fall when some of the trees are changing. I’ll be sure to bring my fancy camera with me on that trip!</p>\n<p>Hope you have a great Monday! Share any motivational quotes you like below!</p>\n",
  "featuredImage": {
    "src": "/posts/motivation-monday-believe-2/featured.jpg",
    "width": 2448,
    "height": 2448,
    "alt": "Motivation Monday: Believe on Katie Crafts; http://www.katiecrafts.com"
  },
  "categories": [
    {
      "id": 1,
      "name": "Hodgepodge",
      "slug": "hodgepodge"
    }
  ],
  "tags": [
    {
      "id": 1426,
      "name": "believe",
      "slug": "believe"
    },
    {
      "id": 1372,
      "name": "motivation monday",
      "slug": "motivation-monday"
    },
    {
      "id": 1425,
      "name": "roosevelt",
      "slug": "roosevelt"
    },
    {
      "id": 1332,
      "name": "shofuso japanese house and garden",
      "slug": "shofuso-japanese-house-and-garden"
    }
  ]
}