{
  "title": "DIY Glitter Mug Tutorial",
  "slug": "diy-glitter-mug",
  "date": "20160317",
  "publishedDate": "2016-03-17",
  "excerpt": "<p><p>Glitter may be the “herpes” of the craft world, but I love it just the same! I’ve been glittering everything lately, and thought I would show you guys how to do it as well. You can do ANY shape you like, or even your initial if you prefer. I have several mugs with “K” already on […]</p></p>",
  "content": "<p>Glitter may be the “herpes” of the craft world, but I love it just the same! I’ve been glittering everything lately, and thought I would show you guys how to do it as well. You can do ANY shape you like, or even your initial if you prefer. I have several mugs with “K” already on them, so I decided I’d do something to celebrate today, St. Patrick’s Day: a 4 leaf clover! Let’s whip out the</p><strong><a href=\"/how-to-make-an-adhesive-stencil-two-ways/\">stencil we made yesterday</a></strong><p>and get to work!</p><p>Just because I made a shamrock for my mug, doesn’t make this a St. Paddy’s Day craft exclusively- as I said you can do anything your heart desires! You can even glitter just the bottom half of the mug instead of a shape if you like. Tips for that are at the bottom of the page.</p><h2>Materials:</h2><ul><li><p>Adhesive stencil*</p></li><li><p>Glitter in your choice of color (I used</p><strong><a href=\"http://amzn.to/1T8BOch\" target=\"_blank\" rel=\"nofollow noopener noreferrer\">Martha Stewart’s Iridescent Glitter</a></strong><p>again!)</p></li><li><p>Mod Podge, Gloss</p></li><li><p>Ceramic mug</p></li><li><p>Dry paint brush</p></li><li><p>Foam brush</p></li><li><p>Paper</p></li></ul><p>*</p><em><p>Make your own adhesive stencil by hand</p></em><p>or</p><em><p>use your Silhouette Cameo machine to craft one</p></em><p>!</p><strong><a href=\"/how-to-make-an-adhesive-stencil-two-ways/\">Click here to learn how to make an adhesive stencil by hand or with your Cameo!</a></strong><h2>Instructions:</h2><ul><li><p>Pick where on your mug you would like the image to be. Take into account whether you are right- or left-handed. When you bring the mug up to your mouth, only one side of the mug shows (while the other is hidden). You want the design to be on the correct side so everyone around you can enjoy the cuteness too!</p></li></ul><ul><li><em><p>Slowly</p></em><p>and</p><em><p>gently</p></em><p>place your adhesive stencil down on your mug. You may need to pull it up and re-lay it a couple of times to get it perfect. That’s why contact paper stencils are so great! They aren’t going to permanently stick to your mug instantly thus they give you the flexibility to shift things if needed.</p></li><li><p>Be sure all the inside parts of the stencil are totally flat and adhered to the mug.</p></li><li><p>Fold your paper in half and create a crease, then unfold it and lay it on your table in front of you. You’ll be using this as your workspace.</p></li></ul><ul><li><p>Use a thin coat of Mod Podge on your foam brush to completely cover the inside of the stencil- in my case, the shamrock. On places that are thinner cuts that may want to come up (like the inside slivers of the clover leaves), sweep the Mod Podge on from the outside towards the inside. If you go from the inside to the outside, your brush may pull up the stencil.</p></li></ul><p><img class=\"size-full post__image\" src=\"/posts/diy-glitter-mug/img-0977.jpg\" alt=\"DIY Glitter Mug Tutorial on Katie Crafts; http://www.katiecrafts.com\" width=\"980\" height=\"980\"></p><ul><li><p>Tap the glitter all over your Mod Podge’d area until it is completely covered. Be sure to do so over the paper so you don’t make a mess!</p></li></ul><p><img class=\"size-full post__image\" src=\"/posts/diy-glitter-mug/img-0978.jpg\" alt=\"DIY Glitter Mug Tutorial on Katie Crafts; http://www.katiecrafts.com\" width=\"980\" height=\"980\"></p><ul><li><p>Let the mug sit and dry for an hour.</p></li><li><p>Use a dry paintbrush to gently brush off any excess glitter from the design. Be sure to go over the middle of the design as well, to get rid of loose glitter.</p></li><li><p>Repeat the Mod Podge/Glitter steps a second time if there are spots showing through without glitter.</p></li></ul><p><img class=\"size-full post__image\" src=\"/posts/diy-glitter-mug/img-0980.jpg\" alt=\"DIY Glitter Mug Tutorial on Katie Crafts; http://www.katiecrafts.com\" width=\"980\" height=\"980\"></p><ul><li><p>Remove stencil and let mug dry for an hour.</p></li></ul><p><img class=\"size-full post__image\" src=\"/posts/diy-glitter-mug/img-0988.jpg\" alt=\"DIY Glitter Mug Tutorial on Katie Crafts; http://www.katiecrafts.com\" width=\"980\" height=\"980\"></p><ul><li><p>Use dry paintbrush to again brush off excess glitter. Use your fingernail to scrape off any parts that bother you and make it look pretty!</p></li></ul><p><img class=\"size-full post__image\" src=\"/posts/diy-glitter-mug/img-0992.jpg\" alt=\"DIY Glitter Mug Tutorial on Katie Crafts; http://www.katiecrafts.com\" width=\"980\" height=\"980\"></p><ul><li><p>Dab some Mod Podge on your foam brush and go over the image one last time, this time to seal the glitter in.</p></li><li><p>Replace excess glitter back in it’s container using the folded piece of paper.</p></li><li><p>Let mug dry for a day before you use it!</p></li></ul><p><img class=\"size-full post__image\" src=\"/posts/diy-glitter-mug/img-0996.jpg\" alt=\"DIY Glitter Mug Tutorial on Katie Crafts; http://www.katiecrafts.com\" width=\"980\" height=\"980\"></p><h2>Tips:</h2><ul><li><p>If you just want to glitter the bottom half of your mug, you’ll do almost all the same steps. There are only a couple changes:</p><ul><li><p>Instead of a using a contact paper stencil, you will just use electrical tape around the bottom of the mug to get a clean line. I balance a pencil on something the height I want the line and gently turn the mug, marking it all the way around. Then I tape right above that line all the way around to get it straight.</p></li><li><p>I also use a different sealant for those. I opt for Triple Thick rather than Mod Podge, as it gives it a glass-like feel so it’s not glittery/gritty feeling. You can do the same for today’s tutorial, but since your hands aren’t wrapped around the image you are doing it really isn’t necessary. Especially because I do 2 – 3 coats of Triple Thick (waiting 24 hours in between each) rather than just one layer of Mod Podge sealant like in this tutorial.</p></li></ul></li><li><p>Really want to try this tutorial but don’t want to ruin one of the pretty coffee mugs in your cabinet? I got this one for a dollar at Ikea! There are usually also really nice ones at your local Dollar store too! They do the job perfectly. The Dollar Tree is also where I buy my contact paper!</p></li><li><p>Don’t forget to</p><em><p>wash your foam brush</p></em><p>in between layers! It starts to dry pretty quickly and once it does, there is no bringing it back to life.</p></li><li><p>These mugs are</p><strong><p>HAND WASH ONLY</p></strong><p>!!!! Do not put in dishwasher, do not let soak in water. Simply hand wash the inside. The sealant on the outside will keep the glitter from falling all over the place, but if hot water is blasted on it or it’s soaked for a period of time, it will sadly come off. There IS a dishwasher safe version of Mod Podge that will hold up better, but it takes 28 days to cure before it can be used/washed. If you are that patient, that’s awesome! I am not. 😉</p></li></ul><p>What will you glitter on your mug?</p>",
  "featuredImage": {
    "src": "/posts/diy-glitter-mug/featured.jpg",
    "width": 1326,
    "height": 1326,
    "alt": "DIY Glitter Mug Tutorial on Katie Crafts; http://www.katiecrafts.com"
  },
  "categories": [
    {
      "id": 1737,
      "name": "Crafts",
      "slug": "crafts"
    }
  ],
  "tags": [
    {
      "id": 1589,
      "name": "affiliate links",
      "slug": "affiliate-links"
    },
    {
      "id": 1409,
      "name": "amazon affiliates",
      "slug": "amazon-affiliates"
    },
    {
      "id": 288,
      "name": "clover",
      "slug": "clover"
    },
    {
      "id": 72,
      "name": "crafts",
      "slug": "crafts-2"
    },
    {
      "id": 185,
      "name": "diy",
      "slug": "diy"
    },
    {
      "id": 78,
      "name": "glitter",
      "slug": "glitter"
    },
    {
      "id": 198,
      "name": "how to",
      "slug": "how-to"
    },
    {
      "id": 1661,
      "name": "martha stewart glitter",
      "slug": "martha-stewart-glitter"
    },
    {
      "id": 1655,
      "name": "mug",
      "slug": "mug"
    },
    {
      "id": 287,
      "name": "shamrock",
      "slug": "shamrock"
    },
    {
      "id": 1240,
      "name": "st. patricks day",
      "slug": "st-patricks-day"
    },
    {
      "id": 1662,
      "name": "stencil",
      "slug": "stencil"
    },
    {
      "id": 187,
      "name": "tutorial",
      "slug": "tutorial"
    }
  ]
}
