{
  "title": "",
  "slug": "mabel-faceplanting",
  "date": "20140810",
  "publishedDate": "2014-08-10",
  "excerpt": "\n",
  "content": "\n<div class=\"post__gallery\"><div class=\"post__gallery-item\">\n          <img class=\"post__gallery-image post__image\" src=\"/posts/mabel-faceplanting/img-3437-1.jpg\" alt=\"Mabel Faceplant on Katie Crafts; https://www.katiecrafts.com\" width=\"600\" height=\"400\" loading=\"lazy\" decoding=\"async\">\n        </div><div class=\"post__gallery-item\">\n          <img class=\"post__gallery-image post__image\" src=\"/posts/mabel-faceplanting/img-3436-2.jpg\" alt=\"Mabel Faceplant on Katie Crafts; https://www.katiecrafts.com\" width=\"600\" height=\"400\" loading=\"lazy\" decoding=\"async\">\n        </div><div class=\"post__gallery-item\">\n          <img class=\"post__gallery-image post__image\" src=\"/posts/mabel-faceplanting/img-3434-3.jpg\" alt=\"Mabel Faceplant on Katie Crafts; https://www.katiecrafts.com\" width=\"600\" height=\"400\" loading=\"lazy\" decoding=\"async\">\n        </div>\n\t\t</div>\n\n",
  "categories": [
    {
      "id": 9,
      "name": "Cats",
      "slug": "cats"
    }
  ],
  "tags": [
    {
      "id": 975,
      "name": "faceplant",
      "slug": "faceplant"
    },
    {
      "id": 370,
      "name": "kitty",
      "slug": "kitty"
    },
    {
      "id": 37,
      "name": "loves cats",
      "slug": "loves-cats-2"
    },
    {
      "id": 19,
      "name": "mabel",
      "slug": "mabel"
    }
  ]
}