{
  "title": "",
  "slug": "lucky-and-mabel-as-baby",
  "date": "20140517",
  "publishedDate": "2014-05-17",
  "excerpt": "<p>How cute was the little Peanut when she was a kit? Her little ‘cone’ had to stay on for two weeks after her surgery and was bigger than she was. Loved the photos from it!</p>\n",
  "content": "<p><img loading=\"lazy\" decoding=\"async\" class=\"aligncenter size-medium wp-image-2527\" src=\"https://i0.wp.com/www.katiecrafts.com/wp-content/uploads/2014/05/IMG_3817-663x495.jpg?resize=663%2C495&ssl=1\" alt=\"Lucky and Mabel as Baby on Katie Crafts; http://www.katiecrafts.com\" width=\"663\" height=\"495\" data-recalc-dims=\"1\" ></p>\n<p style=\"text-align: center;\">How cute was the little Peanut when she was a kit? Her little ‘cone’ had to stay on for two weeks after her surgery and was bigger than she was. Loved the photos from it!</p>\n",
  "categories": [
    {
      "id": 9,
      "name": "Cats",
      "slug": "cats"
    }
  ],
  "tags": [
    {
      "id": 370,
      "name": "kitty",
      "slug": "kitty"
    },
    {
      "id": 37,
      "name": "loves cats",
      "slug": "loves-cats-2"
    },
    {
      "id": 46,
      "name": "lucky",
      "slug": "lucky"
    },
    {
      "id": 19,
      "name": "mabel",
      "slug": "mabel"
    }
  ]
}