{
  "title": "Wordless Wednesday: So Long Sweet Summer",
  "slug": "wordless-wednesday-so-long-sweet-summer",
  "date": "20140910",
  "publishedDate": "2014-09-10",
  "excerpt": "<p>Wordless Wednesday: So Long Sweet Summer Doesn’t this photo say it all? Lucky enjoys a last shred of Summer: corn on the cob, freshly buttered and hand-served via his Papa.</p>\n",
  "content": "<p style=\"text-align: left\"><strong>Wordless Wednesday: So Long Sweet Summer</strong></p>\n<p style=\"text-align: left\">Doesn’t this photo say it all? Lucky enjoys a last shred of Summer: corn on the cob, freshly buttered and hand-served via his Papa.</p>\n<p style=\"text-align: left\">The end of Summer always makes me think of this Dashboard Confessional song:</p>\n<p style=\"text-align: left\"><em>So long sweet summer,</em><br>\n<em>I stumbled upon you and gratefully basked in your rays.</em><br>\n<em>So long sweet slumber.</em><br>\n<em>I fell into you now you’re gracefully falling away.</em></p>\n<p style=\"text-align: left\">Ahh, Dashboard. I think I’ll whip out my old albums and reminisce now.</p>\n<p style=\"text-align: left\">What ways will you enjoy your last bit of Summer? Are you happy or sad to see the heat leave and the brisk air roll in?</p>\n",
  "featuredImage": {
    "src": "/posts/wordless-wednesday-so-long-sweet-summer/featured.png",
    "width": 663,
    "height": 250,
    "alt": "Wordless Wednesday: So Long Sweet Summer on Katie Crafts; http://www.katiecrafts.com"
  },
  "categories": [
    {
      "id": 9,
      "name": "Cats",
      "slug": "cats"
    }
  ],
  "tags": [
    {
      "id": 1047,
      "name": "corn",
      "slug": "corn"
    },
    {
      "id": 1049,
      "name": "dashboard confessional",
      "slug": "dashboard-confessional"
    },
    {
      "id": 46,
      "name": "lucky",
      "slug": "lucky"
    },
    {
      "id": 1048,
      "name": "so long sweet summer",
      "slug": "so-long-sweet-summer"
    },
    {
      "id": 856,
      "name": "summer",
      "slug": "summer"
    },
    {
      "id": 1050,
      "name": "wordless wednesday",
      "slug": "wordless-wednesday"
    }
  ]
}