{
  "title": "Amigurumi Lemon and Lime",
  "slug": "amigurumi-lemon-and-lime",
  "date": "20150814",
  "publishedDate": "2015-08-14",
  "excerpt": "<p>My crocheted fruit filled bowl is getting crowded slowly but surely! The bowl is now brimming with cherries, a pear, an orange, a lemon and a lime! (Next up: a plum and a banana!) Learn how to make the happy little lemon and lime right here!</p>\n",
  "content": "<p>My crocheted fruit filled bowl is getting crowded slowly but surely! The bowl is now brimming with <strong><a href=\"/amigurumi-cherries-pattern/\">cherries</a></strong>, a pear, an orange, a lemon and a lime! (Next up: a plum and a banana!) Learn how to make the happy little lemon and lime right here!</p>\n<p>Crafter June Gilbank has a wonderful blog called <a href=\"http://www.planetjune.com/blog/\" target=\"_blank\" rel=\"noopener noreferrer\">Planet June</a> where she offers some free crochet patterns, including several amigurumi citrus patterns! I used June’s lemon and lime patterns as the basis for my cute little smiling citrus, with a few tweaks. Please make sure you <a href=\"http://www.planetjune.com/blog/free-crochet-patterns/amigurumi-citrus-collection/\" target=\"_blank\" rel=\"noopener noreferrer\">head over to her site to her original patterns</a>, because they are just wonderful! As I was using a different yarn and hook and wanted the lemon a little larger, I had to make a couple changes to mine, which are listed below.</p>\n<h2>Lemon</h2>\n<h3>Materials:</h3>\n<ul>\n<li>Yellow worsted weight yarn</li>\n<li>Lime green worsted weight yarn</li>\n<li>G6 crochet hook</li>\n<li>Stuffing/polyfill</li>\n<li>2 Solid black safety eyes, 6mm (with backs)</li>\n<li>Embroidery floss, black</li>\n<li>Embroidery needle</li>\n<li>Yarn needle</li>\n<li>Stitch marker</li>\n</ul>\n<h3>Pattern Notes:</h3>\n<p>dec = decrease</p>\n<p>inc = increase</p>\n<p>sc = single crochet</p>\n<p>st = stitch</p>\n<h3>Instructions:</h3>\n<p>Start with green yarn.</p>\n<ul>\n<li>Round 1: 4 sc into a ring, change to yellow yarn.</li>\n<li>Round 2: (inc in next st, sc in next st) 2x – (6)</li>\n<li>Round 3: (inc in next st, sc in next st) 3x – (9)</li>\n<li>Round 4: (sc in next st, inc in next st, sc in next st) 3x – (12)</li>\n<li>Round 5: (inc in next st, sc in next st) 6x – (18)</li>\n<li>Round 6: (sc in next st, inc in next st, sc in next st) 6x – (24)</li>\n<li>Rounds 7 + 8: sc in each st around – (24)</li>\n<li>Round 9: (inc in next st, sc in next 3 st) 6x – (30)</li>\n<li>Rounds 10 – 14: sc in each st around – (30)</li>\n<li>Round 15: (dec, sc in next 3 st) 6x – (24)</li>\n<li>Rounds 16 + 17: sc in each st around – (24)</li>\n<li>Round 18: (sc in next st, dec, sc in next st) 6x – (18)</li>\n<li>Round 19: (dec, sc in next st) 6x – (12)</li>\n<li>Round 20: sc in each st around – (12)</li>\n<li><em>Take a break from crocheting for a moment. Decide where you want your eyes to be and follow instructions on safety eyes package to attach them. Then use embroidery floss and needle to stitch on a mouth. Make sure it’s secured so it cannot be pulled out. Then add your stuffing, shaping the lemon. Okay, continue crocheting now!</em></li>\n<li>Round 21: (dec, sc) 4x – (8)</li>\n<li>Round 22: dec til closed. Finished off. Weave in ends.</li>\n</ul>\n<h2>Lime</h2>\n<h3>Materials:</h3>\n<ul>\n<li>Lime green worsted weight yarn</li>\n<li>G6 crochet hook</li>\n<li>Stuffing/polyfill</li>\n<li>2 Solid black safety eyes, 6mm (with backs)</li>\n<li>Embroidery floss, black</li>\n<li>Embroidery needle</li>\n<li>Yarn needle</li>\n<li>Stitch marker</li>\n</ul>\n<h3>Pattern Notes:</h3>\n<p>dec = decrease</p>\n<p>inc = increase</p>\n<p>sc = single crochet</p>\n<p>st = stitch</p>\n<h3>Instructions:</h3>\n<ul>\n<li>Round 1: 4 sc into a ring</li>\n<li>Round 2: (inc in next st, sc in next st) 2x – (6)</li>\n<li>Round 3: inc in each st around – (12)</li>\n<li>Round 4: (inc in next st, sc in next st) 6x – (18)</li>\n<li>Round 5: (sc in next st, inc in next st, sc in next st) 6x – (24)</li>\n<li>Round 6: sc in each st around – (24)</li>\n<li>Round 7: (inc, sc in next 7 st) 3x – (27)</li>\n<li>Round 8 – 10: sc in each st around – (27)</li>\n<li>Round 11: (dec, sc in next 7 st) 3x – (24)</li>\n<li>Round 12: sc in each st around – (24)</li>\n<li>Round 13: (sc in next st, dec, sc in next st) 6x – (18)</li>\n<li>Round 14: (dec, sc in next st) 6x – (12)</li>\n<li>Round 15: dec til closed. Finished off. Weave in ends.</li>\n</ul>\n<p>I’m thinking of finishing off the bowl with a cute little heart shaped peach! What other fruits should I add? What other free amigurumi crochet patterns do you want to see?</p>\n",
  "featuredImage": {
    "src": "/posts/amigurumi-lemon-and-lime/featured.png",
    "width": 1280,
    "height": 1280,
    "alt": "Amigurumi Lemon & Lime Crochet Patterns on Katie Crafts; http://www.katiecrafts.com"
  },
  "categories": [
    {
      "id": 1737,
      "name": "Crafts",
      "slug": "crafts"
    }
  ],
  "tags": [
    {
      "id": 316,
      "name": "amigurumi",
      "slug": "amigurumi"
    },
    {
      "id": 31,
      "name": "crochet",
      "slug": "crochet"
    },
    {
      "id": 57,
      "name": "free pattern",
      "slug": "free-pattern"
    },
    {
      "id": 107,
      "name": "freebie friday",
      "slug": "freebie-friday"
    },
    {
      "id": 1440,
      "name": "fruit bowl",
      "slug": "fruit-bowl"
    },
    {
      "id": 342,
      "name": "lemon",
      "slug": "lemon"
    },
    {
      "id": 1439,
      "name": "lime",
      "slug": "lime"
    }
  ]
}