{
  "title": "Spring Flowers Nail Art",
  "slug": "spring-flowers-nail-art",
  "date": "20160404",
  "publishedDate": "2016-04-04",
  "excerpt": "<p>It’s April already! Wow! The year is flying by and the weather is changing every day. I saw tons of beautiful flowers and trees blooming all over this weekend so I figured I may as well try a new Spring Flowers nail art design for Manicure Monday! This one incorporates negative space, happy Spring colors, [&hellip;]</p>\n",
  "content": "<p>It’s April already! Wow! The year is flying by and the weather is changing every day. I saw tons of beautiful flowers and trees blooming all over this weekend so I figured I may as well try a new Spring Flowers nail art design for Manicure Monday! This one incorporates negative space, happy Spring colors, flowers and rhinestones for a really fun look.</p>\n<p>You can use whatever nail polish colors you prefer, but the below picks are the ones I liked for this tutorial.</p>\n<h2>Materials:</h2>\n<ul>\n<li>Yellow nail polish</li>\n<li>Pink nail polish</li>\n<li>Lavender nail polish</li>\n<li>Light blue nail polish</li>\n<li>Clear top coat</li>\n<li>Dotting tool</li>\n<li>Acrylic nail art rhinestones</li>\n</ul>\n<h2>Instructions:</h2>\n<ul>\n<li>Begin with clean, dry nails. Pick which you’d like to do flowers on and which you’d like solid. Since I was using four different colors, I decided to do one solid nail of each color and the other six would be floral.</li>\n</ul>\n<div class=\"post__gallery\"><div class=\"post__gallery-item\">\n          <img class=\"post__gallery-image post__image\" src=\"/posts/spring-flowers-nail-art/img-1798-1.jpg\" alt=\"Spring Flowers Nail Art Tutorial by Katie Crafts; https://www.katiecrafts.com\" width=\"600\" height=\"400\" loading=\"lazy\" decoding=\"async\">\n        </div><div class=\"post__gallery-item\">\n          <img class=\"post__gallery-image post__image\" src=\"/posts/spring-flowers-nail-art/img-1799-2.jpg\" alt=\"Spring Flowers Nail Art Tutorial by Katie Crafts; https://www.katiecrafts.com\" width=\"600\" height=\"400\" loading=\"lazy\" decoding=\"async\">\n        </div>\n\t\t</div>\n\n<ul>\n<li>Use the large end of the dotting tool dipped in your first color, and make 3 to 5 dots in a circle to create a flower. Do this in random spots on each of the nails you’ve designated as “flower nails.” Let dry in between layers.</li>\n</ul>\n<div class=\"post__gallery\"><div class=\"post__gallery-item\">\n          <img class=\"post__gallery-image post__image\" src=\"/posts/spring-flowers-nail-art/img-1800-3.jpg\" alt=\"Spring Flowers Nail Art Tutorial by Katie Crafts; https://www.katiecrafts.com\" width=\"600\" height=\"400\" loading=\"lazy\" decoding=\"async\">\n        </div><div class=\"post__gallery-item\">\n          <img class=\"post__gallery-image post__image\" src=\"/posts/spring-flowers-nail-art/img-1801-4.jpg\" alt=\"Spring Flowers Nail Art Tutorial by Katie Crafts; https://www.katiecrafts.com\" width=\"600\" height=\"400\" loading=\"lazy\" decoding=\"async\">\n        </div>\n\t\t</div>\n\n<ul>\n<li>Clean off your dotting tool and repeat this process with the other three colors, one at a time. Be sure to flip your dotting tool over and use the smaller end to make tinier flowers, too!</li>\n<li>While your flowers finish drying, do one coat of each solid on your remaining nails. Let dry completely, and do a second coat. Let dry.</li>\n<li>When ALL your nails are COMPLETELY dry (not even tacky!), you may seal in your look with clear polish. If they are still slightly damp, the flower colors will streak into each other and ruin your design!</li>\n</ul>\n<div class=\"post__gallery\"><div class=\"post__gallery-item\">\n          <img class=\"post__gallery-image post__image\" src=\"/posts/spring-flowers-nail-art/img-1802-5.jpg\" alt=\"Spring Flowers Nail Art Tutorial by Katie Crafts; https://www.katiecrafts.com\" width=\"600\" height=\"400\" loading=\"lazy\" decoding=\"async\">\n        </div><div class=\"post__gallery-item\">\n          <img class=\"post__gallery-image post__image\" src=\"/posts/spring-flowers-nail-art/img-1805-6.jpg\" alt=\"Spring Flowers Nail Art Tutorial by Katie Crafts; https://www.katiecrafts.com\" width=\"600\" height=\"400\" loading=\"lazy\" decoding=\"async\">\n        </div><div class=\"post__gallery-item\">\n          <img class=\"post__gallery-image post__image\" src=\"/posts/spring-flowers-nail-art/img-1803-7.jpg\" alt=\"Spring Flowers Nail Art Tutorial by Katie Crafts; https://www.katiecrafts.com\" width=\"600\" height=\"400\" loading=\"lazy\" decoding=\"async\">\n        </div><div class=\"post__gallery-item\">\n          <img class=\"post__gallery-image post__image\" src=\"/posts/spring-flowers-nail-art/img-1804-8.jpg\" alt=\"Spring Flowers Nail Art Tutorial by Katie Crafts; https://www.katiecrafts.com\" width=\"600\" height=\"400\" loading=\"lazy\" decoding=\"async\">\n        </div>\n\t\t</div>\n\n<ul>\n<li>With the clear polish still wet, carefully place a nail gem in the center of a few select flowers on each nail. If you have quick drying top coat, make sure you only paint one nail at a time to assure the polish is still wet enough to hold the rhinestone.</li>\n</ul>\n<div class=\"post__gallery\"><div class=\"post__gallery-item\">\n          <img class=\"post__gallery-image post__image\" src=\"/posts/spring-flowers-nail-art/img-1806-9.jpg\" alt=\"Spring Flowers Nail Art Tutorial by Katie Crafts; https://www.katiecrafts.com\" width=\"600\" height=\"400\" loading=\"lazy\" decoding=\"async\">\n        </div><div class=\"post__gallery-item\">\n          <img class=\"post__gallery-image post__image\" src=\"/posts/spring-flowers-nail-art/img-1807-10.jpg\" alt=\"Spring Flowers Nail Art Tutorial by Katie Crafts; https://www.katiecrafts.com\" width=\"600\" height=\"400\" loading=\"lazy\" decoding=\"async\">\n        </div>\n\t\t</div>\n\n<ul>\n<li>Let your nails dry and then clean up any stray polish from your skin.</li>\n<li>You’re all done! Happy Spring!</li>\n</ul>\n<p>What other Spring nail art tutorials would you like to see? Comment below and I’ll try a new one soon!</p>\n",
  "featuredImage": {
    "src": "/posts/spring-flowers-nail-art/featured.jpg",
    "width": 1326,
    "height": 1326,
    "alt": "Spring Flowers Nail Art Tutorial by Katie Crafts; http://www.katiecrafts.com"
  },
  "categories": [
    {
      "id": 1737,
      "name": "Crafts",
      "slug": "crafts"
    }
  ],
  "tags": [
    {
      "id": 983,
      "name": "floral",
      "slug": "floral"
    },
    {
      "id": 127,
      "name": "flowers",
      "slug": "flowers"
    },
    {
      "id": 384,
      "name": "manicure monday",
      "slug": "manicure-monday"
    },
    {
      "id": 40,
      "name": "nail art",
      "slug": "nail-art"
    },
    {
      "id": 219,
      "name": "nail design",
      "slug": "nail-design"
    },
    {
      "id": 1339,
      "name": "negative space",
      "slug": "negative-space"
    },
    {
      "id": 329,
      "name": "spring",
      "slug": "spring"
    }
  ]
}