{
  "title": "Words for Wednesday: Dare",
  "slug": "words-for-wednesday-dare",
  "date": "20150819",
  "publishedDate": "2015-08-19",
  "excerpt": "<p><p>Happy Wednesday! Today’s wonderful quote is one from the dreamer himself, Walt Disney. “First, Think. Second, Believe. Third, Dream. & Finally, Dare.”</p></p>",
  "content": "<p><br></p><p>Happy Wednesday! Today’s wonderful quote is one from the dreamer himself, Walt Disney.</p><blockquote><p><i><b>“First, Think.</b></i></p><p><i><b>Second, Believe.</b></i></p><p><i><b>Third, Dream.</b></i></p><p><i><b>&#x26; Finally, Dare.”</b></i></p></blockquote><p>Today I am spending the day with my dear friend and her babes at the Philly Zoo- yay! The zoo is where my Husband and I first met (okay, we met on the journey to the zoo but didn’t actually speak until we were there!) and I haven’t been back in years so I’m excited to go. It will also be fun to go with a little kid who will find wonder in it! I hope whatever your day holds, you remember Disney’s words!</p><p>Share your Words for Wednesday below!</p>",
  "featuredImage": {
    "src": "/posts/words-for-wednesday-dare/featured.jpg",
    "width": 1024,
    "height": 1024
  },
  "categories": [
    {
      "id": 1,
      "name": "Hodgepodge",
      "slug": "hodgepodge"
    }
  ],
  "tags": [
    {
      "id": 1020,
      "name": "quote",
      "slug": "quote"
    },
    {
      "id": 1066,
      "name": "walt disney",
      "slug": "walt-disney"
    },
    {
      "id": 1068,
      "name": "words for wednesday",
      "slug": "words-for-wednesday"
    }
  ]
}
