{
  "title": "Words For Wednesday: Smile",
  "slug": "words-for-wednesday-smile",
  "date": "20150624",
  "publishedDate": "2015-06-24",
  "excerpt": "<p><p>Words For Wednesday: Smile “Be Happy And Smile!” Sometimes it’s as easy as that! It may be a hard thing to do, but simply smiling can improve your mood.</p></p>",
  "content": "<p>Words For Wednesday: Smile</p><p><em>“Be Happy And Smile!”</em></p><p>Sometimes it’s as easy as that! It may be a hard thing to do, but simply smiling can improve your mood.</p><p>No matter what you’re doing right now, stop and smile! And have a great (happy) Wednesday! 🙂</p>",
  "featuredImage": {
    "src": "/posts/words-for-wednesday-smile/featured.jpg",
    "width": 1024,
    "height": 1024,
    "alt": "Words For Wednesday: Smile on Katie Crafts; http://www.katiecrafts.com"
  },
  "categories": [
    {
      "id": 1,
      "name": "Hodgepodge",
      "slug": "hodgepodge"
    }
  ],
  "tags": [
    {
      "id": 1384,
      "name": "happy",
      "slug": "happy"
    },
    {
      "id": 1343,
      "name": "qotd",
      "slug": "qotd"
    },
    {
      "id": 1020,
      "name": "quote",
      "slug": "quote"
    },
    {
      "id": 1383,
      "name": "smile",
      "slug": "smile"
    },
    {
      "id": 1068,
      "name": "words for wednesday",
      "slug": "words-for-wednesday"
    }
  ]
}
