{
  "title": "My Etsy Picks: Back to School Guide",
  "slug": "my-etsy-picks-back-school-guide",
  "date": "20140804",
  "publishedDate": "2014-08-04",
  "excerpt": "<p><p>My Etsy Picks: Back to School Guide Hello, Monday! If you are an avid Katie Crafts reader, you may have noticed that there was no Sunday Funday post yesterday. For the moment, weekend posts (unless it’s something great that I *need* to share *immediately*… like a cat photo) will be on hiatus. I love having […]</p></p>",
  "content": "<p>My Etsy Picks: Back to School Guide</p><p>Hello, Monday! If you are an avid Katie Crafts reader, you may have noticed that there was no Sunday Funday post yesterday. For the moment, weekend posts (unless it’s something great that I *need* to share *immediately*… like a cat photo) will be on hiatus. I love having daily things to share with you guys, but with all the other obligations in my life, and with the beautiful summer days coming to an end soon, I need my weekends to myself! Don’t fret, though! You’ll still see me Monday through Friday, with great posts like the one I have for today: an</p><strong><p>Etsy Back to School Guide</p></strong><p>that you will certainly love!</p><p>It feels like just yesterday I was blogging about</p><a title=\"Grad Gifts: My Etsy Picks\" href=\"/grad-gifts-my-etsy-picks/\">gifts to give the graduates</a><p>in your life, and here we are just a few weeks from starting school up again! Back-to-school shopping with my mom was always my favorite. The art supplies, the colorful notebooks and fun pens, the organizational 5 pocketed binders. . . my Mom loved back to school shopping for me as much as I liked picking it all out. I rarely complained that the summer was ending, because it meant soon I’d get to use my brand new</p><a title=\"Lisa Frank Folders on Amazon\" href=\"http://amzn.to/1s2J48m\" target=\"_blank\" rel=\"noopener noreferrer\">Lisa Frank</a><p>folders! I look forward to the day I get to go back to school shopping with my future kids. I can only hope they enjoy it the way I always did!</p><p>If you are looking for some outside-the-box school supplies, Etsy artists have you covered! Above is a treasury I put together of some really great items for your kids (young and old) so they can start the school year off right! And since it’s only the beginning of August, you have time to order these gifts for them so they can proudly present them their first day back! You can find each of the shops from this treasury listed below. Happy shopping!</p><p>Check out the</p><em><a title=\"Back To School Gift Guide on Etsy\" href=\"https://www.etsy.com/treasury/MTAzNjM3NjF8MjcyNDAyOTAzMQ/back-to-school-guide\" target=\"_blank\" rel=\"noopener noreferrer\">full treasury right here,</a></em><p>and give it a heart if you deem it worthy!</p><ol><li><a title=\"Blessed Type on Etsy\" href=\"https://www.etsy.com/listing/196331927/dorm-decor-college-dorm-decorations-dorm\" target=\"_blank\" rel=\"noopener noreferrer\">Blessed Type</a></li><li><a title=\"Thai Handbags on Etsy\" href=\"https://www.etsy.com/listing/162564051/orange-small-backpack-book-bag-handmade\" target=\"_blank\" rel=\"noopener noreferrer\">Thai Handbags</a></li><li><a title=\"Little Maisie on Etsy\" href=\"https://www.etsy.com/listing/193832082/handwriting-alphabet-back-to-school\" target=\"_blank\" rel=\"noopener noreferrer\">Little Maisie</a></li><li><a title=\"GET Good on Etsy\" href=\"https://www.etsy.com/listing/198172408/multi-colored-zippered-pencil-case-back\" target=\"_blank\" rel=\"noopener noreferrer\">GET Good</a></li><li><a title=\"Brown Cow Creatives on Etsy\" href=\"https://www.etsy.com/listing/158078404/back-to-school-clipart-backgrounds\" target=\"_blank\" rel=\"noopener noreferrer\">Brown Cow Creatives</a></li><li><a title=\"Boutique Sew Unique on Etsy\" href=\"https://www.etsy.com/listing/157177311/first-day-of-kindergarten-tshirt-back-to\" target=\"_blank\" rel=\"noopener noreferrer\">Boutique Sew Unique</a></li><li><a title=\"Dixie Sisters on Etsy\" href=\"https://www.etsy.com/listing/189325012/back-to-school-sticky-note-pad-holder\" target=\"_blank\" rel=\"noopener noreferrer\">Dixie Sisters</a></li><li><a title=\"When It Rains Shop on Etsy\" href=\"https://www.etsy.com/listing/157177311/first-day-of-kindergarten-tshirt-back-to\" target=\"_blank\" rel=\"noopener noreferrer\">When It Rains Shop</a></li><li><a title=\"Musu Store on Etsy\" href=\"https://www.etsy.com/listing/128353241/owl-laptop-case-laptop-bag-laptop-sleeve\" target=\"_blank\" rel=\"noopener noreferrer\">Musu Store</a></li><li><a title=\"Happy Thoughts Gifts on Etsy\" href=\"https://www.etsy.com/listing/160468174/personalized-pencil-crayon-box-art\" target=\"_blank\" rel=\"noopener noreferrer\">Happy Thoughts Gifts</a></li><li><a title=\"Dorm Desk Pockets on Etsy\" href=\"https://www.etsy.com/listing/192679837/the-aussie-pouch-dorm-chair-dorm-desk\" target=\"_blank\" rel=\"noopener noreferrer\">Dorm Desk Pockets</a></li><li><a title=\"Delighted Designs Vinyl on Etsy\" href=\"https://www.etsy.com/listing/158112878/first-last-day-of-school-chalkboard-sign\" target=\"_blank\" rel=\"noopener noreferrer\">Delighted Designs Vinyl</a></li><li><a title=\"Luv Ur Locker on Etsy\" href=\"https://www.etsy.com/listing/155145033/purple-white-polka-dot-locker-wallpaper\" target=\"_blank\" rel=\"noopener noreferrer\">Luv Ur Locker</a></li><li><a title=\"Urban Creative on Etsy\" href=\"https://www.etsy.com/listing/159434858/lime-green-chevron-laundry-bag-and\" target=\"_blank\" rel=\"noopener noreferrer\">Urban Creative</a></li><li><a title=\"Mad For Monograms on Etsy\" href=\"https://www.etsy.com/listing/123645156/personalized-dry-erase-board\" target=\"_blank\" rel=\"noopener noreferrer\">Mad For Monograms</a></li><li><a title=\"Paper Doll Printing on Etsy\" href=\"https://www.etsy.com/listing/153584661/personalized-custom-notepads-from-the\" target=\"_blank\" rel=\"noopener noreferrer\">Paper Doll Printing</a></li></ol><p>Which back to school item do you like the best? Share in the comments!</p>",
  "featuredImage": {
    "src": "/posts/my-etsy-picks-back-school-guide/featured.jpg",
    "width": 663,
    "height": 250,
    "alt": "My Etsy Picks: Back to School Guide on Katie Crafts; http://www.katiecrafts.com"
  },
  "categories": [
    {
      "id": 1737,
      "name": "Crafts",
      "slug": "crafts"
    }
  ],
  "tags": [
    {
      "id": 957,
      "name": "back to school",
      "slug": "back-to-school"
    },
    {
      "id": 816,
      "name": "college",
      "slug": "college"
    },
    {
      "id": 808,
      "name": "dorm room",
      "slug": "dorm-room"
    },
    {
      "id": 82,
      "name": "etsy",
      "slug": "etsy"
    },
    {
      "id": 956,
      "name": "gift guide",
      "slug": "gift-guide"
    },
    {
      "id": 961,
      "name": "grade school",
      "slug": "grade-school"
    },
    {
      "id": 815,
      "name": "high school",
      "slug": "high-school"
    },
    {
      "id": 960,
      "name": "my etsy picks",
      "slug": "my-etsy-picks"
    },
    {
      "id": 958,
      "name": "school shopping",
      "slug": "school-shopping"
    },
    {
      "id": 959,
      "name": "supplies",
      "slug": "supplies"
    },
    {
      "id": 758,
      "name": "treasury",
      "slug": "treasury"
    }
  ]
}
